<?xml version="1.0" encoding="UTF-8"?>
<tangyuan-component xmlns:xsi="http://www.w3.org/2001/XMLSchema-instance"
	xsi:noNamespaceSchemaLocation="http://xson.org/schema/tangyuan/1.2.2/component.xsd">

	<app-placeholder resource="app-placeholder.properties"/>
	<!-- 
	<app-placeholder resource="file:///C:/Users/Lenovo/Desktop/temp/app-placeholder.properties"/>
	 -->
	
	<app-property resource="app-property.inix"/>

	<config-property name="maxWaitTimeForShutDown" value="60"/>
	<config-property name="allServiceReturnXCO" value="true"/>
	<!-- <config-property name="jdkProxy" value="true"/> -->
	<config-property name="shutdownInNewThread" value="true"/>
	
	<!-- <trace-config resource="trace-config.properties"/> -->
	
	<!-- 
	<system-aop pointcut="startup-before" class="org.xson.tangyuan2.demo.ssaop.StartupBefore" />
	<system-aop pointcut="startup-after" class="org.xson.tangyuan2.demo.ssaop.StartupAfter" />
	<system-aop pointcut="shutdown-before" class="org.xson.tangyuan2.demo.ssaop.ShutdownBefore" />
	<system-aop pointcut="shutdown-after" class="org.xson.tangyuan2.demo.ssaop.ShutdownAfter" />
	 -->
	
	<httpclient id="client1" resource="properties/http.client.properties"/>
	
	<!-- <manager resource="properties/http.client.properties"/> 迁移到组件中-->
<!-- 

	<component resource="component-manager.xml" type="manager" />

	<component resource="sql-component.xml" type="sql" />
	<component resource="timer-component.xml" type="timer" />
	<component resource="cache-component.xml" type="cache" />
	<component resource="aop-component.xml" type="aop" />
	<component resource="validate-component.xml" type="validate" />
	<component resource="java-component.xml" type="java" />
	<component resource="rpc-component.xml" type="rpc" />
	<component resource="component-mongo.xml" type="mongo" />
	<component resource="component-mq.xml" type="mq" />
	<component resource="sql-component.xml" type="sql" />
	<component resource="component-hbase.xml" type="hbase" />
	<component resource="component-es.xml" type="es" />
	<component resource="sql-component.xml" type="sql" />
	<component resource="rpc-component.xml" type="rpc" />
 	
 	<component resource="component-mongo.xml" type="mongo" />
 	<component resource="sql-component.xml" type="sql" />
 	
 	<component resource="java-component.xml" type="java" />
 	<component resource="cache-component.xml" type="cache" />
 	<component resource="component-mongo.xml" type="mongo" />	
 	<component resource="component-timer.xml" type="timer" />
 	
 	<component resource="sql-component.xml" type="sql" />
 	<component resource="java-component.xml" type="java" />
 	<component resource="component-aop.xml" type="aop" />
 	<component resource="component-timer.xml" type="timer" />
 	 
 	<component resource="sql-component.xml" type="sql" />
	
	<component resource="component-timer.xml" type="timer" />
	
	<component resource="component-timer-ha.xml" type="timer"/>
	<component resource="java-component.xml" type="java" />
	<component resource="cache-component.xml" type="cache" />
	<component resource="sql-component2.xml" type="sql" />
	
	<component resource="component-tools.xml" type="tools" />
	<component resource="component-hive.xml" type="hive" />
	<component resource="java-component.xml" type="java" />
	
	<component resource="sql-component-oracle.xml" type="sql" />
 -->
 	<component resource="component-tools.xml" type="tools" />
	<component resource="component-rpc-balance.xml" type="rpc" />
	
	<component resource="component-sql.xml" type="sql" />
	
	
	<!-- 插件: 混合服务插件 -->
	<plugin resource="service/service-if-sql.xml" />
	<plugin resource="service/service-if-sql.xml" />
	
</tangyuan-component>
